{
  "$schema": "http://json-schema.org/draft-07/schema#",
  "title": "Resource",
  "description": "Harvestable resource definition",
  "type": "object",
  "required": ["resource_type", "total_yield", "color"],
  "properties": {
    "resource_type": { "type": "string" },
    "total_yield": { "type": "number", "minimum": 0 },
    "color": {
      "type": "array",
      "items": { "type": "number" },
      "minItems": 3,
      "maxItems": 3
    },
    "regenerates": { "type": "boolean" },
    "regen_rate": { "type": "number", "minimum": 0 },
    "regen_delay": { "type": "number", "minimum": 0 },
    "sprite": {
      "type": "object",
      "properties": {
        "base_path": { "type": "string" },
        "states": {
          "type": "object",
          "additionalProperties": {
            "type": ["string", "array"],
            "items": { "type": "string" }
          }
        },
        "three_quarter_threshold": { "type": "number", "minimum": 0, "maximum": 1 },
        "half_threshold": { "type": "number", "minimum": 0, "maximum": 1 },
        "quarter_threshold": { "type": "number", "minimum": 0, "maximum": 1 },
        "offset_y": { "type": "number" },
        "scales": {
          "type": "object",
          "additionalProperties": { "type": "number", "minimum": 0 }
        }
      },
      "required": ["base_path", "states"],
      "additionalProperties": false
    }
  },
  "additionalProperties": false
}
