{
  "resource_type": "food",
  "total_yield": 150,
  "color": [0.8, 0.2, 0.4],
  "regenerates": false,
  "sprite": {
    "base_path": "res://assets/sprites/resources/berry_bush",
    "states": {
      "full": "berry_bush_01.png",
      "three_quarter": "berry_bush_02.png",
      "half": "berry_bush_03.png",
      "stump": "berry_bush_04.png"
    },
    "three_quarter_threshold": 0.75,
    "half_threshold": 0.5,
    "quarter_threshold": 0.25,
    "offset_y": -10.0
  }
}
