{
  "resource_type": "gold",
  "total_yield": 800,
  "color": [0.9, 0.8, 0.1],
  "regenerates": false,
  "sprite": {
    "base_path": "res://assets/sprites/resources/gold_mine",
    "states": {
      "full": "gold_mine_01.png",
      "three_quarter": "gold_mine_02.png",
      "half": "gold_mine_03.png",
      "stump": "gold_mine_04.png"
    },
    "three_quarter_threshold": 0.75,
    "half_threshold": 0.5,
    "quarter_threshold": 0.25,
    "offset_y": -10.0
  }
}
